<?xml version="1.0" encoding="utf-8"?> 
<product version="1.5" xmlns:xsi="http://www.w3.org/2001/XMLSchema-instance" xsi:noNamespaceSchemaLocation="http://www.bom.gov.au/schema/v1.5/product.xsd"><amoc><source><sender>Australian Government Bureau of Meteorology</sender><region>Tasmania</region><office>TASRO</office><copyright>http://www.bom.gov.au/other/copyright.shtml</copyright><disclaimer>http://www.bom.gov.au/other/disclaimer.shtml</disclaimer></source><identifier>IDT13600</identifier><issue-time-utc>2016-03-18T18:23:48Z</issue-time-utc><issue-time-local tz="EDT">2016-03-19T05:23:48+11:00</issue-time-local><sent-time>2016-03-18T18:23:48Z</sent-time><expiry-time>2016-03-19T18:23:48Z</expiry-time><validity-bgn-time-local tz="EDT">2016-03-19T00:00:00+11:00</validity-bgn-time-local><validity-end-time-local tz="EDT">2016-03-25T23:59:59+11:00</validity-end-time-local><next-routine-issue-time-utc>2016-03-19T05:20:00Z</next-routine-issue-time-utc><next-routine-issue-time-local tz="EDT">2016-03-19T16:20:00+11:00</next-routine-issue-time-local><status>O</status><service>WSP</service><sub-service>FCT</sub-service><product-type>F</product-type><phase>NEW</phase></amoc><forecast><area aac="TAS_FA001" description="Tasmania" type="region"><forecast-period start-time-local="2016-03-19T05:23:49+11:00" end-time-local="2016-03-19T05:23:49+11:00" start-time-utc="2016-03-18T18:23:49Z" end-time-utc="2016-03-18T18:23:49Z"><text type="warning_summary_footer">For latest warnings go to www.bom.gov.au, subscribe to RSS feeds, call 1300-659-216* or listen for warnings on relevant TV and radio broadcasts.</text><text type="product_footer">* Calls to 1300 numbers cost around 27.5c incl. GST, higher from mobiles or public phones.</text></forecast-period></area><area aac="TAS_ME001" description="Hobart" type="metropolitan" parent-aac="TAS_FA001"><forecast-period index="0" start-time-local="2016-03-19T00:00:00+11:00" end-time-local="2016-03-20T00:00:00+11:00" start-time-utc="2016-03-18T13:00:00Z" end-time-utc="2016-03-19T13:00:00Z"><text type="forecast">Cloudy. Medium (40%) chance of showers, becoming less likely this afternoon and evening. Winds south to southwesterly 25 to 35 km/h.</text><text type="fire_danger">Low-Moderate</text><text type="uv_alert">UV Alert from 10:40 am to 4:00 pm, UV Index predicted to reach 6 [High]</text></forecast-period><forecast-period index="1" start-time-local="2016-03-20T00:00:00+11:00" end-time-local="2016-03-21T00:00:00+11:00" start-time-utc="2016-03-19T13:00:00Z" end-time-utc="2016-03-20T13:00:00Z"><text type="forecast">Partly cloudy. Light winds becoming southeasterly 15 to 20 km/h in the early afternoon then becoming light in the evening.</text></forecast-period><forecast-period index="2" start-time-local="2016-03-21T00:00:00+11:00" end-time-local="2016-03-22T00:00:00+11:00" start-time-utc="2016-03-20T13:00:00Z" end-time-utc="2016-03-21T13:00:00Z"><text type="forecast">Partly cloudy. Slight (20%) chance of a shower. Light winds.</text></forecast-period><forecast-period index="3" start-time-local="2016-03-22T00:00:00+11:00" end-time-local="2016-03-23T00:00:00+11:00" start-time-utc="2016-03-21T13:00:00Z" end-time-utc="2016-03-22T13:00:00Z"><text type="forecast">Sunny. Light winds becoming northeast to southeasterly 15 to 25 km/h during the afternoon then becoming light during the evening.</text></forecast-period><forecast-period index="4" start-time-local="2016-03-23T00:00:00+11:00" end-time-local="2016-03-24T00:00:00+11:00" start-time-utc="2016-03-22T13:00:00Z" end-time-utc="2016-03-23T13:00:00Z"><text type="forecast">Partly cloudy. Slight (30%) chance of a shower, most likely later in the day. Light winds.</text></forecast-period><forecast-period index="5" start-time-local="2016-03-24T00:00:00+11:00" end-time-local="2016-03-25T00:00:00+11:00" start-time-utc="2016-03-23T13:00:00Z" end-time-utc="2016-03-24T13:00:00Z"><text type="forecast">Partly cloudy. Slight (30%) chance of a shower. Light winds.</text></forecast-period><forecast-period index="6" start-time-local="2016-03-25T00:00:00+11:00" end-time-local="2016-03-26T00:00:00+11:00" start-time-utc="2016-03-24T13:00:00Z" end-time-utc="2016-03-25T13:00:00Z"><text type="forecast">Cloudy. Slight (30%) chance of a shower. Light winds becoming westerly 15 to 20 km/h during the day.</text></forecast-period></area><area aac="TAS_PT021" description="Hobart" type="location" parent-aac="TAS_ME001"><forecast-period index="0" start-time-local="2016-03-19T05:00:00+11:00" end-time-local="2016-03-20T00:00:00+11:00" start-time-utc="2016-03-18T18:00:00Z" end-time-utc="2016-03-19T13:00:00Z"><element type="forecast_icon_code">11</element><element type="precipitation_range">0 to 1 mm</element><element type="air_temperature_maximum" units="Celsius">15</element><text type="precis">Shower or two.</text><text type="probability_of_precipitation">50%</text></forecast-period><forecast-period index="1" start-time-local="2016-03-20T00:00:00+11:00" end-time-local="2016-03-21T00:00:00+11:00" start-time-utc="2016-03-19T13:00:00Z" end-time-utc="2016-03-20T13:00:00Z"><element type="forecast_icon_code">3</element><element type="precipitation_range">0 mm</element><element type="air_temperature_minimum" units="Celsius">8</element><element type="air_temperature_maximum" units="Celsius">18</element><text type="precis">Partly cloudy.</text><text type="probability_of_precipitation">10%</text></forecast-period><forecast-period index="2" start-time-local="2016-03-21T00:00:00+11:00" end-time-local="2016-03-22T00:00:00+11:00" start-time-utc="2016-03-20T13:00:00Z" end-time-utc="2016-03-21T13:00:00Z"><element type="forecast_icon_code">3</element><element type="precipitation_range">0 mm</element><element type="air_temperature_minimum" units="Celsius">10</element><element type="air_temperature_maximum" units="Celsius">19</element><text type="precis">Partly cloudy.</text><text type="probability_of_precipitation">20%</text></forecast-period><forecast-period index="3" start-time-local="2016-03-22T00:00:00+11:00" end-time-local="2016-03-23T00:00:00+11:00" start-time-utc="2016-03-21T13:00:00Z" end-time-utc="2016-03-22T13:00:00Z"><element type="forecast_icon_code">1</element><element type="precipitation_range">0 mm</element><element type="air_temperature_minimum" units="Celsius">11</element><element type="air_temperature_maximum" units="Celsius">22</element><text type="precis">Sunny.</text><text type="probability_of_precipitation">0%</text></forecast-period><forecast-period index="4" start-time-local="2016-03-23T00:00:00+11:00" end-time-local="2016-03-24T00:00:00+11:00" start-time-utc="2016-03-22T13:00:00Z" end-time-utc="2016-03-23T13:00:00Z"><element type="forecast_icon_code">17</element><element type="precipitation_range">0 to 0.4 mm</element><element type="air_temperature_minimum" units="Celsius">13</element><element type="air_temperature_maximum" units="Celsius">22</element><text type="precis">Possible shower.</text><text type="probability_of_precipitation">30%</text></forecast-period><forecast-period index="5" start-time-local="2016-03-24T00:00:00+11:00" end-time-local="2016-03-25T00:00:00+11:00" start-time-utc="2016-03-23T13:00:00Z" end-time-utc="2016-03-24T13:00:00Z"><element type="forecast_icon_code">17</element><element type="precipitation_range">0 to 2 mm</element><element type="air_temperature_minimum" units="Celsius">12</element><element type="air_temperature_maximum" units="Celsius">19</element><text type="precis">Possible shower.</text><text type="probability_of_precipitation">30%</text></forecast-period><forecast-period index="6" start-time-local="2016-03-25T00:00:00+11:00" end-time-local="2016-03-26T00:00:00+11:00" start-time-utc="2016-03-24T13:00:00Z" end-time-utc="2016-03-25T13:00:00Z"><element type="forecast_icon_code">17</element><element type="precipitation_range">0 to 0.2 mm</element><element type="air_temperature_minimum" units="Celsius">11</element><element type="air_temperature_maximum" units="Celsius">20</element><text type="precis">Possible shower.</text><text type="probability_of_precipitation">30%</text></forecast-period></area><area aac="TAS_PT039" description="Kunanyi/Mount Wellington" type="location" parent-aac="TAS_ME001"><forecast-period index="0" start-time-local="2016-03-19T05:00:00+11:00" end-time-local="2016-03-20T00:00:00+11:00" start-time-utc="2016-03-18T18:00:00Z" end-time-utc="2016-03-19T13:00:00Z"><element type="air_temperature_maximum" units="Celsius">5</element></forecast-period></area><area aac="TAS_PT109" description="Bellerive" type="location" parent-aac="TAS_ME001"><forecast-period index="0" start-time-local="2016-03-19T05:00:00+11:00" end-time-local="2016-03-20T00:00:00+11:00" start-time-utc="2016-03-18T18:00:00Z" end-time-utc="2016-03-19T13:00:00Z"><element type="air_temperature_maximum" units="Celsius">15</element></forecast-period></area><area aac="TAS_PT108" description="Glenorchy" type="location" parent-aac="TAS_ME001"><forecast-period index="0" start-time-local="2016-03-19T05:00:00+11:00" end-time-local="2016-03-20T00:00:00+11:00" start-time-utc="2016-03-18T18:00:00Z" end-time-utc="2016-03-19T13:00:00Z"><element type="air_temperature_maximum" units="Celsius">15</element></forecast-period></area><area aac="TAS_PT110" description="Kingston" type="location" parent-aac="TAS_ME001"><forecast-period index="0" start-time-local="2016-03-19T05:00:00+11:00" end-time-local="2016-03-20T00:00:00+11:00" start-time-utc="2016-03-18T18:00:00Z" end-time-utc="2016-03-19T13:00:00Z"><element type="air_temperature_maximum" units="Celsius">15</element></forecast-period></area></forecast></product>
