<?xml version="1.0" encoding="utf-8"?> 
<product version="1.5" xmlns:xsi="http://www.w3.org/2001/XMLSchema-instance" xsi:noNamespaceSchemaLocation="http://www.bom.gov.au/schema/v1.5/product.xsd"><amoc><source><sender>Australian Government Bureau of Meteorology</sender><region>Queensland</region><office>QLDRO</office><copyright>http://www.bom.gov.au/other/copyright.shtml</copyright><disclaimer>http://www.bom.gov.au/other/disclaimer.shtml</disclaimer></source><identifier>IDQ10611</identifier><issue-time-utc>2016-03-18T18:50:00Z</issue-time-utc><issue-time-local tz="EST">2016-03-19T04:50:00+10:00</issue-time-local><sent-time>2016-03-18T18:50:24Z</sent-time><expiry-time>2016-03-19T18:50:00Z</expiry-time><validity-bgn-time-local tz="EST">2016-03-19T00:00:00+10:00</validity-bgn-time-local><validity-end-time-local tz="EST">2016-03-25T23:59:59+10:00</validity-end-time-local><next-routine-issue-time-utc>2016-03-19T06:20:00Z</next-routine-issue-time-utc><next-routine-issue-time-local tz="EST">2016-03-19T16:20:00+10:00</next-routine-issue-time-local><status>O</status><service>WSP</service><sub-service>FCT</sub-service><product-type>F</product-type><phase>NEW</phase></amoc><forecast><area aac="QLD_FA001" description="Queensland" type="region"><forecast-period start-time-local="2016-03-19T04:50:24+10:00" end-time-local="2016-03-19T04:50:24+10:00" start-time-utc="2016-03-18T18:50:24Z" end-time-utc="2016-03-18T18:50:24Z"><text type="warning_summary_footer">For latest warnings go to www.bom.gov.au, subscribe to RSS feeds, call 1300-659-219* or listen for warnings on relevant TV and radio broadcasts.</text><text type="product_footer">* Calls to 1300 numbers cost around 27.5c incl. GST, higher from mobiles or public phones.</text></forecast-period></area><area aac="QLD_ME002" description="Sunshine Coast" type="metropolitan" parent-aac="QLD_FA001"><forecast-period index="0" start-time-local="2016-03-19T00:00:00+10:00" end-time-local="2016-03-20T00:00:00+10:00" start-time-utc="2016-03-18T14:00:00Z" end-time-utc="2016-03-19T14:00:00Z"><text type="forecast">Partly cloudy. High (70%) chance of showers from late this morning. The chance of a thunderstorm this afternoon, possibly severe. Light winds becoming southeasterly 15 to 25 km/h in the late afternoon.</text><text type="fire_danger">Low-Moderate</text><text type="uv_alert">UV Alert from 8:20 am to 3:20 pm, UV Index predicted to reach 11 [Extreme]</text></forecast-period><forecast-period index="1" start-time-local="2016-03-20T00:00:00+10:00" end-time-local="2016-03-21T00:00:00+10:00" start-time-utc="2016-03-19T14:00:00Z" end-time-utc="2016-03-20T14:00:00Z"><text type="forecast">Cloudy. Medium (60%) chance of showers, most likely in the morning and afternoon. The chance of a thunderstorm about the hinterland in the afternoon. Winds southeasterly 15 to 25 km/h.</text></forecast-period><forecast-period index="2" start-time-local="2016-03-21T00:00:00+10:00" end-time-local="2016-03-22T00:00:00+10:00" start-time-utc="2016-03-20T14:00:00Z" end-time-utc="2016-03-21T14:00:00Z"><text type="forecast">Partly cloudy. Slight (30%) chance of a shower. Winds southeasterly 15 to 25 km/h.</text></forecast-period><forecast-period index="3" start-time-local="2016-03-22T00:00:00+10:00" end-time-local="2016-03-23T00:00:00+10:00" start-time-utc="2016-03-21T14:00:00Z" end-time-utc="2016-03-22T14:00:00Z"><text type="forecast">Partly cloudy. Medium (60%) chance of showers, most likely in the morning and afternoon. The chance of a thunderstorm in the afternoon and evening. Winds southeasterly 15 to 25 km/h becoming light during the evening.</text></forecast-period><forecast-period index="4" start-time-local="2016-03-23T00:00:00+10:00" end-time-local="2016-03-24T00:00:00+10:00" start-time-utc="2016-03-22T14:00:00Z" end-time-utc="2016-03-23T14:00:00Z"><text type="forecast">Mostly sunny. Slight (20%) chance of a shower. Light winds becoming easterly 15 to 20 km/h during the day.</text></forecast-period><forecast-period index="5" start-time-local="2016-03-24T00:00:00+10:00" end-time-local="2016-03-25T00:00:00+10:00" start-time-utc="2016-03-23T14:00:00Z" end-time-utc="2016-03-24T14:00:00Z"><text type="forecast">Partly cloudy. Slight (30%) chance of a shower. Light winds becoming easterly 15 to 20 km/h during the day.</text></forecast-period><forecast-period index="6" start-time-local="2016-03-25T00:00:00+10:00" end-time-local="2016-03-26T00:00:00+10:00" start-time-utc="2016-03-24T14:00:00Z" end-time-utc="2016-03-25T14:00:00Z"><text type="forecast">Partly cloudy. Slight (20%) chance of a shower. Light winds becoming northeasterly 15 to 20 km/h during the day.</text></forecast-period></area><area aac="QLD_PT002" description="Maroochydore" type="location" parent-aac="QLD_ME002"><forecast-period index="0" start-time-local="2016-03-19T05:00:00+10:00" end-time-local="2016-03-20T00:00:00+10:00" start-time-utc="2016-03-18T19:00:00Z" end-time-utc="2016-03-19T14:00:00Z"><element type="forecast_icon_code">16</element><element type="precipitation_range">1 to 6 mm</element><element type="air_temperature_maximum" units="Celsius">32</element><text type="precis">Shower or two. Possible storm.</text><text type="probability_of_precipitation">70%</text></forecast-period><forecast-period index="1" start-time-local="2016-03-20T00:00:00+10:00" end-time-local="2016-03-21T00:00:00+10:00" start-time-utc="2016-03-19T14:00:00Z" end-time-utc="2016-03-20T14:00:00Z"><element type="forecast_icon_code">11</element><element type="precipitation_range">1 to 8 mm</element><element type="air_temperature_minimum" units="Celsius">22</element><element type="air_temperature_maximum" units="Celsius">29</element><text type="precis">Shower or two.</text><text type="probability_of_precipitation">60%</text></forecast-period><forecast-period index="2" start-time-local="2016-03-21T00:00:00+10:00" end-time-local="2016-03-22T00:00:00+10:00" start-time-utc="2016-03-20T14:00:00Z" end-time-utc="2016-03-21T14:00:00Z"><element type="forecast_icon_code">17</element><element type="precipitation_range">0 to 1 mm</element><element type="air_temperature_minimum" units="Celsius">21</element><element type="air_temperature_maximum" units="Celsius">29</element><text type="precis">Possible shower.</text><text type="probability_of_precipitation">40%</text></forecast-period><forecast-period index="3" start-time-local="2016-03-22T00:00:00+10:00" end-time-local="2016-03-23T00:00:00+10:00" start-time-utc="2016-03-21T14:00:00Z" end-time-utc="2016-03-22T14:00:00Z"><element type="forecast_icon_code">11</element><element type="precipitation_range">1 to 5 mm</element><element type="air_temperature_minimum" units="Celsius">20</element><element type="air_temperature_maximum" units="Celsius">29</element><text type="precis">Shower or two.</text><text type="probability_of_precipitation">60%</text></forecast-period><forecast-period index="4" start-time-local="2016-03-23T00:00:00+10:00" end-time-local="2016-03-24T00:00:00+10:00" start-time-utc="2016-03-22T14:00:00Z" end-time-utc="2016-03-23T14:00:00Z"><element type="forecast_icon_code">17</element><element type="precipitation_range">0 to 0.2 mm</element><element type="air_temperature_minimum" units="Celsius">20</element><element type="air_temperature_maximum" units="Celsius">30</element><text type="precis">Possible shower.</text><text type="probability_of_precipitation">30%</text></forecast-period><forecast-period index="5" start-time-local="2016-03-24T00:00:00+10:00" end-time-local="2016-03-25T00:00:00+10:00" start-time-utc="2016-03-23T14:00:00Z" end-time-utc="2016-03-24T14:00:00Z"><element type="forecast_icon_code">17</element><element type="precipitation_range">0 to 0.4 mm</element><element type="air_temperature_minimum" units="Celsius">20</element><element type="air_temperature_maximum" units="Celsius">30</element><text type="precis">Possible shower.</text><text type="probability_of_precipitation">30%</text></forecast-period><forecast-period index="6" start-time-local="2016-03-25T00:00:00+10:00" end-time-local="2016-03-26T00:00:00+10:00" start-time-utc="2016-03-24T14:00:00Z" end-time-utc="2016-03-25T14:00:00Z"><element type="forecast_icon_code">3</element><element type="precipitation_range">0 mm</element><element type="air_temperature_minimum" units="Celsius">21</element><element type="air_temperature_maximum" units="Celsius">31</element><text type="precis">Partly cloudy.</text><text type="probability_of_precipitation">20%</text></forecast-period></area><area aac="QLD_PT053" description="Caloundra" type="location" parent-aac="QLD_ME002"><forecast-period index="0" start-time-local="2016-03-19T05:00:00+10:00" end-time-local="2016-03-20T00:00:00+10:00" start-time-utc="2016-03-18T19:00:00Z" end-time-utc="2016-03-19T14:00:00Z"><element type="air_temperature_maximum" units="Celsius">33</element></forecast-period></area><area aac="QLD_PT122" description="Maleny" type="location" parent-aac="QLD_ME002"><forecast-period index="0" start-time-local="2016-03-19T05:00:00+10:00" end-time-local="2016-03-20T00:00:00+10:00" start-time-utc="2016-03-18T19:00:00Z" end-time-utc="2016-03-19T14:00:00Z"><element type="air_temperature_maximum" units="Celsius">31</element></forecast-period></area><area aac="QLD_PT136" description="Nambour" type="location" parent-aac="QLD_ME002"><forecast-period index="0" start-time-local="2016-03-19T05:00:00+10:00" end-time-local="2016-03-20T00:00:00+10:00" start-time-utc="2016-03-18T19:00:00Z" end-time-utc="2016-03-19T14:00:00Z"><element type="air_temperature_maximum" units="Celsius">33</element></forecast-period></area><area aac="QLD_PT138" description="Noosa Heads" type="location" parent-aac="QLD_ME002"><forecast-period index="0" start-time-local="2016-03-19T05:00:00+10:00" end-time-local="2016-03-20T00:00:00+10:00" start-time-utc="2016-03-18T19:00:00Z" end-time-utc="2016-03-19T14:00:00Z"><element type="air_temperature_maximum" units="Celsius">31</element></forecast-period></area></forecast></product>
